from,to,weight,title
94,98,1,"&gt;Just heard that the body of a Pakistani prisoner has been handed over to Pakistan. Why is there no one talking about it here? Yesterday, a mere delay was linked with ill will of Pakistan towards the release of Abhi.Fake news. IAF has not reported anything on its press release or twitter handle. Do not change speculation into news.  Source: [http://timesofindia.indiatimes.com/articleshow/68225068.cms?utm\_source=contentofinterest&amp;utm\_medium=text&amp;utm\_campaign=cppst](http://timesofindia.indiatimes.com/articleshow/68225068.cms?utm_source=contentofinterest&amp;utm_medium=text&amp;utm_campaign=cppst)  Quote:  The IAF said it will talk to Abhinandan about the video and clarify.  "
95,97,2,"He is not wrong. Various Governments knew for over 20 years now that Mig21Bs need to phased out. We still have 113 of them active mate. Embarrassing.&gt; Pick one: The Mig took down a F16 or the Mig is a flying coffinBoth are not mutually exclusive. The Mig21 bison is heavily upgraded with the following - - Russian X-band pulse Doppler radar with slotted array- Russian IRST- European INS and GPS- European MFD- Israeli HUD- New indigenous RWR- Stores management system- Air data computer- Helmet mounted sight- New comms/radios- New canopy (for better pilot visibility)- Ability to fire the R-77 BVRAAM and R-73 WVRAAMIn short, its instantaneous turn rate and acceleration, and the helmet mounted sight combined with R-73 air-to-air missiles make it very effective at close range encounters and interceptions, even against 4.5 gen aircraft. It also has a tremendous advantage because of its low radar visibility. However there is no getting around the fact that its design is obsolete now and it is limited by the capacity of its airframe and needs to be phased out.&gt; Is it a 100% given that a Rafale couldn't have been shot down?Nothing is ever certain in dogfighting but rafale is clearly a vastly superior multirole aircraft. &gt; What result is he talking about?Am assuming he is talking about the loss of our Mig-21 and capture of our pilot. And yes, a more modern aircraft will most likely have improved our chances of success, maybe avoiding the capture of our pilot."
96,50,1,Wow... Nice plot. Will definitely watch that.
97,95,1,Pick one: The Mig took down a F16 or the Mig is a flying coffin. What result is he talking about? Is it a 100% given that a Rafale couldn't have been shot down?
97,105,1,Hindi news channels: Hamare sapoot ka lie detector test kiya gaya... /s
97,120,1,a rival hindi channel: aisa lagta hai unhe current laga ke torture kiya gaya hai... /s
98,119,3,"It wasn't the delay. It was the heavily edited video that came out moments before his release. Don't know why Pakistan felt it needed to do it. Lost a lot of goodwill as a result. &gt; Why does the video matter so much when the guy can contradict with that as soon as he is going to cross over?  Look, I was the first to mention that there were a lot of Pakistanis asking that Abhinandan be treated well. I was genuinely moved by it. But, moments before his release, there's this  video - where it looks like he's been coerced - so you start to feel that you can't really trust Pakistan. On one hand there's talk of peace gesture and on the other there's manipulation.I understand your point. Plus, I don't think its worth going to war over. My feeling about it is to the extent that I can't trust everything Pakistan says. I will continue to advocate for a peaceful resolution.  We are thankful that he's back home. There's a lot of one-upping going on here and having a reasonable debate will be hard. Again, I am thankful Pakistan released him, but the video did do a damage to the trust of even the faithfully liberal person.&amp;#x200B;"
99,56,2,"Very disheartening to hear that you people require proof for a very well documented terrorist head to take action against him.Several security council members accept the proof but it is not enough for Pak? Does Pak have higher standards to declare someone a terrorist? Or does India have so much influence that majority will blindly agree with her? You say JeM is banned? Why is it banned? Is it banned because it is a terrorist organisation? If so dont you think its members need to be arrested?"
99,79,1,"Hey buddy, since you constantly post here, what is your opinion on your FM accepting that your country allows JeM to operate AKA harbours terrorists?"
99,119,2,"As for the hypocrisy, yes it was very hypocritical. It was a propoganda video similar to what NK makes.Killed in prison by criminals who are rotting in prison. Now what do you think should we do? Those people are already on a life term, and in history of India very few people have been executed. People here already condemned it, but we didnt know his mortal remains were being returned today since there was no big announcement."
100,4,1,world is not trashing pakistan. As far as global media is concerned pakistan came out as the good guys just their video released after abhinandan was in india portrayed them in bad light . Thats why they took down the video from all their media handles. no1 has openly taken sides as things havent escalated to that degree
100,119,2,"it aint an excuse to hate. It was all great when it was peace gesture to release him. Releasing a doctored and forced video with 50 cuts is what pissed off people here. There was 0 need for it and moreover added no info that was already known. Worst thing u took interview of our commander in uniform but later was returned in a suit ? Do u know see your fault or still wanna talk here with ur nonsensical facts ?there is no coverage of that news anywhere on indian media. Full disclosure we all hate our media thats why rely on twitter. If its true my heart goes out to u. "
101,50,1,Must be a Techies spammer
102,18,2,"So we should have lied about it when Pakistan had first brought it up?Lol can you imagine the shit show. The Pakistani guy sayng that we invaded their air space and bombed them. Then the Indians denying it outright. Pakistanis coming up with proof. Us denying the proof of the shells or radar too. Are you alright with that scenario?"
102,63,1,Why should we make fat Joe in America believe in this? If the American state wants to know they'll contact the Indian state and not read new York times. 
102,64,1,The Pakistanis lied about two planes being shot down. They lied about having two Indian pilots in custody. They lied about only payload bring dropped and no bombs being dropped in the initial tweets. They lied about not using F16 in the raid. They lied in 2016 about those surgical strikes. If you're a congenital liar then don't expect anyone to give you the benefit of the doubt 
102,79,1,"No man they didn't ask for evidence. They said no evidence is provided. It's a very substantial difference. Jaitley explained it too, it negatively affects the operational secrecy of India therefore evidence won't be provided. Maybe it can be provided later like the 2016 strikes which again were doubted by Pakistanis but then they were proven to be liars, again."
103,98,1,Didn't know one could hold sermons while being so ill that you couldn't even get out of a hospital bed .
104,91,1,"International media's outlook does not matter. The outlook of international governments does. And they have come out in support of India's actions. And if the Indian army claims to have hit whatever they've targeted, I believe that. Not some casualty report of 300 cooked up by the media. "
105,58,1,All those things on Wg cmdr Abhinandan's chest are chest leads used to take an ECG. Probably as a part of routine medical checkup.
105,91,1,Renal failure or air strikes?
105,92,1,"CID team at Wagah borderACP Pradhyuman : Daya, darwaza tod do!"
105,97,1,"No need to write the /s , they'll actually do that."
105,110,1,"CID officer Vivek on the job. Abhijeet ko Balakot site pe bhej dia hai. Pata toh chale maamla hai kya. /s"
106,4,1,Ottoman Empire 
106,35,1,lol ===
106,127,1,"Figure of 300 hundred was made out of thin air by media  ,but 35 still seems like realistic number.Another claim was 1000 kg bomb was dropped...Man ,How shit media is -_+"
106,97,1,===
106,99,1,  Kandahar hijack happened to free Azhar Masood...not sure what else proof is required ..Country which defines terrorists as good terrorists and bad terrorists. ...You can expect sanity from them.
107,70,1,I saw it at 1.5 speed and he's still slow. 
108,21,1,"But we are so used to such video footage since the gulf war in the 90s.  Pakis using this opportunity. Im not for war, but whenever there is intel report on training camp in pok  we should attack preemptively and govt shouldnt chest thump it. "
109,43,2,"[https://twitter.com/Natsecjeff/status/1101992269060734976](https://twitter.com/Natsecjeff/status/1101992269060734976)Even, as per this report [https://www.dni.gov/files/ODNI/documents/2019-ATA-SFR---SSCI.pdf](https://www.dni.gov/files/ODNI/documents/2019-ATA-SFR---SSCI.pdf), the firing / tension in LoC to continue until May elections. If some substantial thing happens about killing terrorists, etc, media will project it as a success for Modi.Yes, both countries won't go for war."
110,63,1,"Air Force won't lie ..if it's caught it goes under severe scrutiny. People lose jobs .. if it's unsuccessful they would just say that.  There are things that surely we should be critical about and ask proof for but not this. I support Air Force and I believe what they announced. I don't care if you guys think I am bakth or whatever ..I completely trust my Army and I rely on them ..hell I am sleeping well tonight based on same trust. I wouldn't doubt it a second."
110,105,1,Mate can you get any sat imagery of Balakot?
111,14,1,"Pakistani here. He did not shoot down any of our jets. These are just claims by your media without any proof. The only proof that was bought up was a picture of a destroyed jet engine, that too was debunked by a specialist on India today. Regardless, he is still a hero as he fought for his country and you guys should be proud of him."
111,42,2,"Uhhh what ? Our army never claimed or did any surgical strikes in 2016. That was your army (that claimed to do so that too without any proof much like this time) in retaliation to an attack that they blamed on Pakistan (similarly without any proof, what you said about the leopard is true after all).I don't bring up local and biased news sources because they do just that. Make BS up to glorify their nation. And you did exactly that. Regardless it's very much possible that this strike did happen and our forces are lying, I'm ready to entertain this possibility even with the proof being shady at best. Hoping your public would do so too."
111,45,1,"Which one ? They lied about the air strike 300 dead bodies were 3 trees at best. Every single international and neutral report indicates that no damage was done to the madrassah in the area. Hell, they didn't even make it to Balakot.It's funny because I'm living in the country where the army has major influence on media and how our history is written, but even then we are skeptical of their claims and whenever they try to feed us some bs. Your public doesn't even seem to be questioning this whole fiasco."
112,106,1,Slight digression but I think it would've been terrible to go to war without 42 IAF squadrons ready. 
113,98,1,He admitted to being targeted but not that they were hit. This is damning for both countries. It pretty much alludes that India tried but failed to attack their camps and it alludes that Pakistan lies about JeMs presence in the area.
114,129,1,Did he sleep?
114,117,1,Ok
115,25,1,But they didn't target our buildings. That's what they announced to the media. Unlike ours. 
116,42,1,"&gt; But honestly in these reports it's basically the fact that she'll lose all credibility and her livelihood if found to be true that basically are the proof for it.**?????**"
116,51,2,"Could be. But reports are coming they will fully open their Air space by tomorrow.yeah and Air space is open now. LOL"
116,75,1,"I know Urdu and he said, his camps were recruits trained for Jehad was Bombed."
116,83,2,"&gt;  It's still partially closed.But why have they closed it? According to official narrative of DGISPR, India's Air raid on 26th Feb was dud and harmed nothing but some trees and Pakistan's raid of 27th Feb was much more successful thus implying Pakistan is far more superior air power. So why this knee jerk reaction contradicting triumphant official claims?And second thing I wanted to ask is about Fuel shortage in Pakistan as some claims going on SM. Is it true? If so, then why?OK. Don't worry, things are settling and normalcy should return in Pak soon. Man, I'm also normal guy, who's afraid of dying but these routine terror attacks have exhausted our patience and somber nature. We all here are afraid to die but if terrorism continued this way, then we will surely die sooner than later. That's the reason why were we Indian's rattling sabers in past few days but no hard feelings for Pakistani people in general.  "
116,91,1,"&gt;  ISI storyWhich story?"
117,71,1,Credits go to u/DegnerOshold
118,35,1,Because god made them that way
118,120,1,"Yeah , imagine a Boeing carrying bombs like a bomber and a FUCKING BrahMos tipped with a goddamn nuclear warhead for shits and giggles . That is gonna cause some lethal damage my friend >#>#>#>#"
119,18,1,"yeah, lets go back in history and quote unrelated 'alleged' events to the present scenario"
119,19,2,"Same, if you want to remain stuck on the video, instead of looking at the bigger picture that you got your guy aliveI could google several events where you were the bad guys at a certain turn of history and quote here, but what would be the point? The gesture of releasing him was about peace. Not finding and then stuck onto imperfections in those acts"
119,38,1,"What I did, all those comments, it wasn't for them, I did it for me, I guess. I have been having identity crisis, and events like these only make it clear where I belong. I thought of myself as someone who could acknowledge good or bad, irrespective of their national background, think critically, but I see hatred winning over every single battle and it's pointless to debate when majority in the world just want one over you to win an argument, rather than going for objectivity.This is true for my own countrymen as well, but seeing myself &amp; few others, as people who could take a saner perspective when shit hits the fan here, I thought may be I could find myself among them, but I was so wrong. I don't suppose this would make sense"
119,49,1,"Pakistan is the hypocrite as it made a video of the guy who it saved from mob lynching and was about to hand over, sure. What do you think about the body of Pakistani prisoner who was killed in your prison?"
119,98,2,"Why does the video matter so much when the guy can contradict with that as soon as he is going to cross over? May be some people just need an excuse to hate othersWhat part of not killing the guy you don't understand? If a 'coerced' video of him make Pakistan look ingenuine, then may be it's lost to give peace another chance. May as well go to war, since there will always be people unhappy about the semantics of things being done for peace."
119,99,1,"What were the jail authorities doing when the inmates were stoning our guy? Guess, he didn't get saved like your pilot who was attacked by our mob.I don't expect an investigation into it regarding why this happened, or who overlooked the safety of him as that would only anger your extremists. Despite being called a terrorist nation, sanity still prevailed here. "
119,100,1,"You can't make everyone happy. If it weren't the video, people may have jumped upon why he wasn't sent via air. Or why wasn't he saved earlier. Or why wasn't he fed pizza. It's useless to make such things an excuse when at the end of the day, what matters most, is we returned your guy alive. With all the extremism my country has, I think it was an achievement on our part. It's not a competition, but i expected better than a body in response."
119,120,1,"So are mobs, but guess what? Sanity prevailed and the armed officers, of the same army you criticize for the cuts, saved him from lynching. I wonder what Geneva conventions say about not giving a fuck about the enemy fighter jet pilot, who crossed the border in a bid to target the locals there only to find being torn apart by their hands."
120,35,1,"I am not sure why Pakistan is shittiing bricks, some twitter handles are saying ,we are ready with Missiles. Saw a needy program where they said ""India has modified planes to look like commercial crafty and then attack Pakistan"". Looks like they are sure that we are going to attack them. "
120,124,1," Dude seriously ? Ok let me try explaining, a soldier leaves his loved ones behind and goes  to war to defend his motherland, did his duty without any fear, conducted himself with grace under fire and comes back . What is he if not a hero. At his play I would have said anything to appease my captor's, but he held his grace. For me he is a hero as is any other soldier who is giving his everything for me"
120,97,1,"Dude NO, don't give them fucking ideas! .all please downvote this comment.."
120,119,3,"Mere delay ? It was not that he had taken a loan and he needed to close that before he leaves Pakistan. You had all the time to film him with 17 cuts but not release him ,oh and you wanted him to be released with all pump and show to humiliate him. The way camera was panning of his face by your Camera operator's says it all. We are sorry about Pakistani being killed in jail but then jail's are not filled with rational people.I guess this fact of "" beating by locals"" can be taken from the guy who as per your spokesman "" is in hospital"" , wonder what happened to him also wonder what happened to the 2 jets you shot. Geneva convention or not , you returned him , thanks but don't take a moral high ground of being a country where everyone is a peace loving hippie. You are a Terrorist state and you know it. Jihadi country to be specific.Had he been killed by your Jihadi country men with clips on special Media then (a) International community would have taught you a lesson (b) India would have made you shit bricks . Because in that case no one could have justified a NO WAR tagline."
121,35,1,Some high level banter comments on that thread.