from,to,weight,title
51,27,1,This seems actually more of a possibility than SAM precautionary measure 
51,42,1,"Its ridiculous isnt it? Although I cant clearly see whats happening in the video, the commentary says 2 pilots so that means either SU30 or 2seater F16. 2 jets were downed that day the other jet is a fucking mystery! Did it just disappear into thin air? "
51,49,1,Im more inclined to believe it is to stop swarm of journalist coming into the country
51,56,1,what? that's pretty significant!
51,124,2,"He is fighting for our country and for us which brought him to an enemy territory, thats an instant hero and massive amount of well wishes for his safety and return from the public. Many like me had a feeling of dread when I say his captured photographs. I wish I can share the pain and humiliation he faced at the hands of the enemy and the dread especially when the locals tricked him into saying he is Indian pilot, thats must have been  dreadful.Its very simple, if you do not realize he is a hero then you will never realize. "
51,70,1,"Exactly, that one guy said why India not releasing the before after satellite images. IDK how stupid he can be, why would the military want to give away our surveillance capabilities just to prove a point?"
51,72,1,That too at 1 am in the night
51,129,1,Damn some people really are dense
51,83,1,I feel they don't want foreign journalists swarming Balakot
51,116,2,"I feel they don't want foreign journalists swarming Balakot. What do you think?Yep but the cleanup is already done"
52,48,1,excellent!
53,49,1,"Our army doesn't need PR and doesn't need to whitewash a bad image, unlike Pakistan.   India officially released the video of 2016 air strikes in 2018.  It's part of strategy and planning, it's not like they'll give you proofs just because a couple of media houses start claiming random stuff.  "
53,63,1,"On what basis do you think you deserve to know the proof while the operation is going on?Read about some doctrines of war. This is not how militaries is the world function. The army shouldn't be forced to do PR work while the situation is so tense. Once the situation calms down, they can decide what to show and what to keep covert, based on what suits them strategically. "
54,5,1,They're updated only every few months for most locations.
54,68,1,Doesn't hurt to ask if somebody has access to such a service through their work or something. I'm trying to sign up on Planet Labs where you can explore a bit for free.
55,35,1,Finally an Indian ex-Foreign minister to compete with Pakistan's in the most idiotic comments Olympics.
55,36,1,"*Shalom*, you called?"
55,50,1,Nawazuddin Siddiqui as ganjedi Railway Minister.
55,106,1,"This is hilarious. Even better than this onehttps://www.youtube.com/watch?v=rZr5dx57RG0&amp;feature=youtu.be"
55,111,1,Fractal trolling
55,119,1,Your username is hilarious. I think it describes Pakistani media just perfectly :)
55,125,1,"Their radar systems can't handle too many moving targets at a time. So by shutting their airspace, they expect to be able to identify any Indian air force planes coming in for a hit more easily."
56,130,1,that's it? >#=
56,19,1,"huh? that isn't a sensitive area otherwise you would never get any pictures. but we do have pictures which means it isn't sensitive/blocked by google. he said we were being targetted. as in they were the goal, that doesn't mean they were hit. it's been said many times that there was a madressa in that area but missed by few kilometres. "
56,27,2,"wasn't promptly closed. 2 days after is when it closed, when pak caught indian pilot and there were news of a possible attack.fyi reuter, independent and washington post have articles out. try reading them. not a single one supports indian narrative. Attack happened on the 25th actually. Flights were stopped on the day of pilot arrest when escalation was happening.FYI some Indian airports were closed the same day too. &gt;""Srinagar, Jammu and Leh airports were among five airports closed on Wednesday for civilian air traffic shortly after an IAF [Indian Air Force] jet crashed in Kashmirs Budgam district,"" the Press Trust of India, a news agency reported."
56,49,1,"Really? As a Pakistani, when I read NDTV twitter comments, they are usually getting bashed. I thought maybe they're biased. "
56,51,1,"im being sarcastic. i mean seriously? we are going off what ""eye witness"" said now? how the fuck do you know there was a ISI agent or ek-pak army killed? amount of delusion is insane to believe that but not give any attention to satellite verification conducted independently. no one can erase that proof, not pakistan nor india. https://www.aspistrategist.org.au/were-indias-airstrikes-in-pakistan-a-strategy-for-public-approval/"
56,66,2,"because pakistan never denied his existence in pakistan or acknowledged him as a terrorist. what exactly is the big deal? we already know pakistan doesn't acknowledge him as one otherwise there would be a legitimate case for india intl to ask why he isn't in jail. not pakistan. and as the minister claims here, it was supposedly conveyed to him that JeM denied involvement. i think indians need to realize that whether you call them terrorist sor not it doesn't matter. it matters if pakistan does and they dont so there is no ""blunder"" in what the minister has said here. "
56,87,1,"i dont know why indians are so delusional. setting your own goal posts that you know you can achieve even if they make no sense. pakistan never denied jem existence in pakistan so what is the big deal? pakistan has confessed their contact with azhar masood, not jem. learn to differentiate organization with individual&gt;No country will share details of their military operations and that includes US who has scarcely given details about their counter terrorist ops in past and present.no one is asking for military details. this is a bombing, you can easily prove it by satellite images which won't compromise any military details. &gt; If Pakistan so staunchly believes that no terrorists are being raised on it's soil, why are you hell bent on asking for a proof?because u keep crying about it. being a neighbour country, we have to look into your reservations. or you think we should ignore you? that would be better?"
56,99,2,"he didn't say that. jem is banned, not azhar mehmood. how is it very well documented if you have no proof? yes we require proof, we will not do something just because you said so. likewise we don't expect you to do anything just because we said so. its illogical. "
57,54,1,"Yes, let me call my friend at FBI."
58,21,1,"But but when international media and analysis pointing other way. At some point you need to tell the whole world. It's not like you have some serious supersecret facility. You claim to bomb the terrorist facility in other country.  What's the purpose of claiming and not showing anything. Edit : if India possesses any technology that's not open to world then I am up for it. But again there's proof floating that there is no damage done. I am behind my govt but if something starts to smell as propaganda I WILL question. "
58,50,2,"Why this username reminds me of my neighboring country!  OK.  My username is same in CS:GO.Let's meet sometime,  you will play terrorist and I will play counter terrorist. Deal? "
58,63,1,Let elections come near like 10 days to go!! 
58,126,1,WTF 
58,91,1,Mama elections 
59,121,1,"Looks like they're really sweeping out the terrorists, sleeper cells, it is a difficult situation to people of Kashmir."
60,28,1,"No he is not kidding.  Even though Pakistan overall has a worse image in the international community, Pakistan has come out looking like the more sensible state in this specific episode.  India claimed surgical strikes which international community did not object to but then presented no evidence that even 1 militant was killed.  The international social media was retweeting pictures of trees being hit.  Then there were images of Indian jet wreckage and also a live Indian pilot sipping tea with Pakistan army.All this while Imran Khan kept pleading for peace and Modi was making delayed empty statements. Modi's tactics backfired and India lost the PR battle and this is what most articles on western media outlets reflected.  This isn't to say Pakistan overall has the better image around the world, it doesn't but in this instance they came out looking better.  At the very least in the eyes of the international public."
60,97,1,"Dogfighting is all about positioning.  Whoever gets behind has a massive advantage, even if their aircraft is inferior.  If F-16s were on the run then a Mig 21 can shoot it from behind, same can be said of a Pakistani Mirage shooting down Sukhoi 30 in retreat, it doesn't say much about the pilots capability if that is the case."
61,56,1,Its happened on 3:30 am on 26 the feb
61,124,1,"You don't chose to be a hero, you got selected as hero"
61,72,3,"These rumours are getting worse than football transfer rumoursNo war have been fought till today? Ending terrorism would need a full scale invasion like America did to Afghanistan , India ,now and not in future would be able to mount that type of invasion Yeah it should ,and as before diplomacy would be the way , terrorism exist for the reason , and reason is people have invested in it to exist I think it just a business model to keep India and Pakistan on brink of war."
61,131,1,35 sounds believable
62,10,1,"Check sources for other news channels and Ndtv channel. While other channels are relying on information from twitter handles. Ndtv is discussing things through the information provided by Indian defence during press conference.Also please go through IAF press conference on 2nd day with reports published on news channels. You will find out that there is over exaggeration on all the news channels other than NDTV. "
62,85,1,"India is changing narrative from victory to intention. First day govt leaked it to media that around 300 people killed. Next day Indian pilot caught by Pakistan and Indian defence had to do a press briefing in this they claimed its immature to assume casualties. Now international official sources have confirmed that India had intelligence to the target but we did not hit the target. If we have to put fear in Pakistan we have to show our capability by hitting them right on target not by showing our  intent or chest thumping with unverified numbers. "
63,110,1,"I think the same, but international media have no reason to think so.They need to provide evidence to convince other people. "
64,102,1,"The Indian government is refusing to provide evidence, therefore the Pakistanis are liars.Wah. Just brilliant."
65,14,1,And the fact that he thought of swallowing those documents. Showed real composure throughout. He did not seem to crack under pressure and did his job right. 
65,122,1,It's really hard to give ABP news credibility after that shit storm they've pulled. 
65,119,1,All we're saying is that releasing that edited video serves nothing good for either country. And Pakistan would've been in big trouble if they killed the WC.
66,35,1,Has there ever been an opposition so weak?
66,56,1,"But don't all countries except china already accept JeM as a terrorist organisation? and after them taking responsibility for pulwama attack i don't understand why this isn't a bigger issue. They talk like we're just speculating this shit with no proof. It doesn't matter if pakistan doesn't want to acknowledge them as a terrorist group, but if they accept they house them there should be more pressure to hand over him to us. Shit like this is the reason i stand behind government's decision of being more bold against them (still don't want any war tho)"
66,71,1,How do news channels not run clips like this 24*7 is something i'll never understand
66,111,1,Our army has never given a reason to not trust them on the other hand yours...
67,19,1,"Are bhai, their foreign minister has the balls to go on BBC and claim that JeM involvement not confirmed in pulwama Attack. Highly recommend you watch that interview! He pretty much gives the whole game away!Dont ever expect honesty or truth from this part of the world, they have a deeply ingrained insecurity that allows them to perversely rationalize every aspect of their nations behaviour."
67,100,1,"World is not = to global media. Are you high?Paks 2 biggest allies stood by and watched India be the aggressor for the first time ever and did nothing.. UN Security Council March petition to designate Azhar as global terrorist is still going to happen. If you want to cherrypick articles from known ultra liberal publications (no offence to them, am a liberal myself), thats your choice. But the facts are evident from the actions (or lack thereof) that global powers have undertaken in response to this conflict. "
67,111,1,"Hey Lahori guy, welcome! People who live in glass houses should not throw Osama Bin Ladens. Oops!! I meant stones! "
67,113,1,"Equally damning? I certainly dont think so.One side tried and arguably failed to eliminate a dangerous threat, the other has spilled the beans (directly and indirectly) that they harbour and maybe even support these groups.. I know which one Id take.."
68,54,1,If there's any such known public service people would have already jumped on it and shared images on twitter. 
69,91,1,"&gt;  ISI story of Col Salim)What is that?"
70,88,1,"Idk how well it summaries. The anchor tries to pin the 300 number on the government which is not true and talks like the civilians are entitled a briefing on a military operation. There is a very obvious  bias in the narrative being pushed."
71,117,1,"Bruh, I know this is a theory but damn, this makes perfect sense. You good. Let's see if we get more info.&gt;Pakistan denied using F-16s in the operation, said it was JF-17s.I don't think they said it was JF17s, iirc they only said F-16s weren't used. "
72,35,1,Lol yesterday he tweeted that Pakistan has killed scores of Indian officer by sniping them. He is a rumor mongerer. 
72,49,1,The evidence can be used by jihadis for recruitment purposes. When has our military ever lied to us? Pak mil is a deep state within itself and has a history of hiding facts from pak public. Don't fall for pak propaganda. 
72,50,1,And in 2030 the pak mil will finally acknowledge their soldier who died fighting for his country and give him some sort of award... You know cuz pak mil has a standard 10 years period before they acknowledge their soldiers sacrifice like in the kargil and 1971 wars. 
72,61,2,"The cost of supporting terrorism has to be increased for pak.... Pak is the epicenter of terrorism.... If it becomes hard to Pakistan to train terrorists.... It will have an effect world wideCommon man 40 years of diplomacy achieved nothing... Time to adopt new method"
72,76,2,"They are blackmailing you.... Our countrymen will die horrible deaths at the hands of these terrorists for the next 40 years more if we don't act nowThey have to be countered on all front. Limited military action was absolutely nessesary and it has to become the norm now so that Pakistan knows the blackmail it is doing by putting a gun to its own head... One day or another it may have to actually pull the trigger.Edit : BTW wow what ideal view of geopolitics you haveRe edit.: I did not mean that as attack on you... I am just saying your view is quite idealistic"
72,91,2,"It doesn't matter.... Has our military ever conducted itself in a non professional manner in the 70 years of history.... Their reputation is such that we can take their statements as truth. National security cannot be compromised like that plus the enemy will also learn of confidential spy satellite capabilities..."
72,98,2,"And he has already said that the pak authorities Mentally harassed him when he was in their costody This should be pinned for better visibility "
72,100,1,Lol just because a few publications came out with articles that did not bash Pakistan doesn't mean Pakistan has come out looking like a good guy.... The whole world condemned the pulwama attack.... USA France UK all came out with statement that they supported India's right to defend itself..... Not a single country said anything against India after the airstrike...not even China....infact France EU and USA asked Pakistan to do more to combat terrorism after the airstrike to de escalate tension. Pakistan is utterly isolated...even IOc ignored Pakistan after the airstrike... Sushma swaraj was the chief guest while Pakistan FM was sulking at home. It released our pilot within 48 hours and it did not do it out of self will... Otherwise quereshi wouldn't be in front camera trying to justify to pak public why they released the pilot without any deal from India. Erdogen may have some reason to stick with Pakistan. 
73,122,1,"I mean let's be real, he wasn't there for a peace mission."
74,98,1,Make a separate post of this for better visibility.
75,82,1,I dont know urdu man. 
76,72,2,"You do realize youre advocating for a solution that would likely kill a billion, if not two billion, right? Pakistan should be fighting against the terrorists it allows and encourages to operate against India. But there is no solution, except diplomacy, that wouldnt kill millions. A better solution would be to isolate Pakistan. Encourage the rest of the world to recognize Pakistan as a sponsor of terrorism. Boycott and cut them off. Make them a pariah state that they should have been after 9/11. Sure, theyll lash out with more attacks. But eventually (hopefully) their citizens will push for their government to do something about the camps on their soil. But military action against Pakistan will lead to untold suffering in both countries. War wont make it better, just much worse and faster. "
77,54,1,"Yes, let me call my friend at CIA."
78,124,1,"The fact that he probably downed an f16 with an mig,The fact that he managed to survive as long as he did after parachuting into enemy territory,The fact that he refused to divulge any classified information without knowing he was being recorded(as he was blindfolded) knowing full well that he was going to be tortured or probably killed for it,The fact that after being through so much in so less time he didn't loose his composure and the cuts in the propaganda video might mean that he didn't exactly say everything that the enemy would've wanted him to say."
79,4,1,"Who is ""thrashing"" Pakistan ?"
79,17,1,hahaha this made my day
80,27,1,"Standard procedure for any law enforcement agency anywhere in the world is to close down the scene of crime to prevent contamination and a multitude of other things.You're clutching at straws here. "
81,21,1,"I agree - people are like I want to know, I have a right to know and these same people dont know shit about basic stuff in life but they are suddenly experts in military strategies:)I wish the media was not being an asshole all the time, and just did its job to tell people the news and not a Bollywood movie plot"
81,122,1,"he downed one of their F16s, it would be unreal to think that there was no hostility towards him. The India side too had caught one of theirs would not have just kept him all cushioned up. Am just glad hes back home - lets just not get into the rats ass to find out was he tortured or not, please. Lets just respect his valor and the imagine the happiness in his family that hes back - everything is bullshit for us people to talk about!Every armed forces personnel knows that when you get battle ready, there is a price to pay. We citizens should just be so grateful that we continue to live our lives as chickens because these brave hearts live their lives like that."
82,75,1,"If you listen to the clip, he says the camp was targeted. He does not say they were hit."
83,132,1,"I'm Pakistani. It's still partially closed. Some airports are open for domestic flights, but no international flights have yet been allowed. It's being said that normal flight operations will resume from 4th March. It should. I have a lot of relatives that are stuck ._. "
83,86,1,"No international flights at all. It's kinda worrisome tho, at least for me. I don't think we're on high alert anymore except LoC. So why close the entire country's airspace? What about India? Is the airspace completely open?"
83,116,1,"Man I really don't know why it's closed lelI'm a normal guy who's afraid of dying. Fuel shortage? O.o who's saying that? There isn't no fuel shortage, not any that I'm aware of. You got any links to where people are saying that?"
84,19,1,Plus helped the Jadhav case become stronger. In that case video evidence was actually asked for. 
85,64,1,That doesn't rule out that they are not.
86,83,2,"Makes no sense why not allow international flights, unless foreign carriers doesnt want to fly in yet. What about PIA international flights?I am not sure ( lives in US) but last i checked it was even open during those tense days ( except for three hours). "
87,56,1,"The denial is extreme. In last two days, slowly but steadily Pakistan's JeM relations are coming out from mouths of their own people and ministers. Wait for a few days, everything will fall apart from your own side.Now since Pakistan has openly confessed their contact with JeM, why don't you tell them to telecast a pre-recorded video of terrorist that India declared dead and taken his name specifically in press conference?No country will share details of their military operations and that includes US who has scarcely given details about their counter terrorist ops in past and present.If Pakistan so staunchly believes that no terrorists are being raised on it's soil, why are you hell bent on asking for a proof?When people are at fault and hide their crimes, they seek for approval from outside."
88,48,1,"I really  like these rajyasabha and losabha channel very calm and informative discussion, big fan of them for sometime now, "
89,21,1,"Yup why need proof we are people of faith. We believe whatever crap politicians are feeding us. It helps us bolster our ego.Why use critical thinking , why look for different sources to corroborate one sides claim.For us blind faith is everything.Tomorrow if Modi comes and tell us that he invaded Pakistan and China  and ask us to just believe him, we will ofcourse do that.Independent international media my foot."
89,124,1,because he nearly sacrificed his life for his country.
90,127,1,"""Jo bhi humare masle hai, hum dehshatgardi karwake ke hal karenge"" Its hilarious lol."
91,49,1,Correct and took a dig on the people who got in it's (sale) way
91,51,1,"Do you really feel that if the pakis had downed a sukhoi, they would've had been quite about this?"
91,54,1,"I did a little side investigation and found the latest images on mainstream websites to be atleast 6 mithd old (lol) but google it. Some organisation already did it and they seem to have found results whoch are available in their article. This however, also is the article that the pakis seem to be parading and obviously its a private organisation so there's next to no credibility. Oh and the coordinates are available on wikipedia. If you find a way, do check for yourself too"
91,69,1,I am getting a feeling that this whole dialysis thing is a sham and he got injured in the strikes (referring to the ISI story of Col Salim)
91,72,3,"Yeah but its an endless loophole then. The world then believes that we did nothing and it all comes back to square one (whether we should release evidence or not)&gt;Has our military ever conducted itself in a non professional manner in the 70 years of historyI never disputed that. I believe that it isn't even in my ability to do so considering how much they've done for us. But, international outlook also matters and I'm not blaming anyone here. Im just putting things as they are, like here is a problem. Solve it.Exactly what I've been trying to convince the subreddit for the past 2 days. I'd face a really bloody war head on, rather than suffering this faux ""peace"" for another 70 years."
92,54,1,Yes let me call my friend at CID
93,66,1,https://www.unionjournalism.com/2019/03/01/pakistan-pilot-killed-by-local-pakistani-thinking-he-was-an-indian-pilot/
93,111,1,Chobey ji uth jao subah ho chuki Hain!
93,120,1,"&gt;Pakistani being killed in jailAre you referring to the Lynched pilot?"
94,72,1,"Anecdotal and not empirical. Indian covert operations are rarely declassified and are more than what meets the eye. Just look at the historical unification of India or the support to LTTE as an example . &amp;#x200B;Do note, I am not saying that the strikes didn't happen or that a building wasn't destroyed. However, I question the loss of life. The strikes in itself is a major step and should be ""questionably applauded"". But loss of life at 3:30AM?  Remember when the 2016 surgical strikes were carried out, villagers could be quoted saying the area was blocked and many trucks could be seen entering. This time its different - even the villagers are laughing."
